{
  "schema_version": "1.0",
  "source": "file://<REPO>/tests/fixtures/chart-source.svg",
  "metadata": {
    "title": "chart-source.svg",
    "language": "en",
    "description": "",
    "author": "",
    "keywords": "",
    "canonicalUrl": "",
    "publishedTime": ""
  },
  "blocks": [
    {
      "id": "block-00001",
      "locator": "body > main > p",
      "text": "IMAGE DOCUMENT",
      "type": "paragraph"
    },
    {
      "id": "block-00002",
      "locator": "body > main > h1",
      "text": "chart-source.svg",
      "type": "heading",
      "level": 1
    },
    {
      "id": "block-00003",
      "locator": "body > main > figure",
      "text": "Text recognized within visual asset asset-001: Service Score\nJan 82\nFeb 87\nMar 91\nApr 95\nchart-source.svg",
      "type": "figure",
      "caption": "chart-source.svg",
      "assetIds": [
        "asset-001"
      ]
    }
  ],
  "links": [],
  "visual_assets": [
    {
      "id": "asset-001",
      "file": "assets/asset-001.png",
      "kind": "img",
      "width": 640,
      "height": 240,
      "alt": "chart-source",
      "aria_label": "",
      "title": "",
      "caption": "chart-source.svg",
      "source_url": "file://<REPO>/tests/fixtures/chart-source.svg",
      "nearby_heading": "chart-source.svg",
      "ocr": {
        "text": "Service Score\nJan 82\nFeb 87\nMar 91\nApr 95",
        "confidence": 96.05,
        "language": "eng",
        "engine": "Tesseract"
      },
      "sha256": "3729919abbbd32c38c0bc624c2b71bf99c388023c3472371a5dca5e4dd45116f"
    }
  ]
}
